3/4/2025 10:08:51,9789390612475,"Berek & Novak’s Gynecology, South Asian ed",Medical,Hardcover,"Rs 12,798.00","₹ 7,999.00",,,2,,"Rs 25,596.00",
3/4/2025 10:08:51,9788126521494,"Biostatistics: Basic Concepts and Methodology for the Health Sciences, 9e",Medical,Paperback,"Rs 1,760.00",,,,4,,"Rs 7,040.00",
3/4/2025 10:08:51,9781260468014,"Williams Gynecology, 4e",Medical,Hardcover,"Rs 19,400.00","₹ 12,000.00",,,1,,"Rs 19,400.00",
3/4/2025 10:08:51,9781264598434,"WILLIAMS OBSTETRICS, 26e",Medical,Hardcover,"Rs 19,250.00","₹ 11,000.00",,,1,,"Rs 19,250.00",
3/4/2025 10:08:51,9789351296072,"Nursing Research Generating and Assessing Evidence For Nursing Practice, 10e",Medical,Paperback,"Rs 2,800.00",₹ 699.00,,,1,,"Rs 2,800.00",
3/4/2025 10:08:51,9789354669262,"Clinical Methods in Pediatrics, 6e",Medical,Paperback,"Rs 1,752.00","₹ 1,095.00",,,1,,"Rs 1,752.00",
3/4/2025 10:08:51,9788131266069,"The Elements of Fracture Fixation, 5e",Medical,Paperback,"Rs 3,376.00","₹ 2,110.00",,,3,,"Rs 10,128.00",
3/4/2025 10:08:51,9789356961852,"SRB’s Manual of Surgery, 7e",Medical,Paperback,"Rs 2,960.00","₹ 1,850.00",,,1,,"Rs 2,960.00",
3/4/2025 10:08:51,9789354656422,Manual of Practical Medicine,Medical,Paperback,"Rs 2,640.00",,,,3,,"Rs 7,920.00",
3/4/2025 10:08:51,9781119241355,Smith's Textbook of Endourology: 2 Volume Set,Medical,Hardcover,"Rs 59,500.00",,,,1,,"Rs 59,500.00",
3/4/2025 10:08:51,9780323834612,"Ross and Wilson Anatomy and Physiology in Health and Illness, International Edition, 14e",Medical,Paperback,"Rs 2,760.00","₹ 1,795.00",,,1,,"Rs 2,760.00",
3/4/2025 10:08:51,9788131244180,Orban's Oral Histology and Embryology,Medical,Hardcover,,"₹ 1,995.00",,,1,,Rs 0.00,
3/4/2025 10:08:51,9788131244647,"Textbook of Clinical Neuroanatomy, 3e",Medical,Paperback,"Rs 1,000.00",,,,1,,"Rs 1,000.00",
3/4/2025 10:08:51,9781108474405,High Risk Pregnancy Management Options 5Ed 2 Vol Set,Medical,Hardcover,"Rs 14,392.00","₹ 7,995.00",,,2,,"Rs 28,784.00",
3/4/2025 10:08:51,9781498751773,"APLEY & SOLOMON'S SYSTEM OF ORTHOPAEDICS AND TRAUMA, 10e",Medical,Paperback,"Rs 7,192.00","₹ 4,495.00",,,3,,"Rs 21,576.00",
3/4/2025 10:08:51,9789389776980,"Medicine: MCQs for Medical Professionals, 5e",Medical,Paperback,"Rs 3,512.00","₹ 1,995.00",,,1,,"Rs 3,512.00",
3/4/2025 10:08:51,9788123918105,Parasitology Protozoology And Helminthology 13E,Medical,Paperback,,₹ 795.00,,,1,,Rs 0.00,
3/4/2025 10:08:51,9789388313278,"Feigenbaum’s Echocardiography, 8th South Asian ed",Medical,Hardcover,"Rs 14,400.00","₹ 8,999.00",,,1,,"Rs 14,400.00",
3/4/2025 10:08:51,9780323795166,Ophthalmology (IE) -6E ,Medical,Paperback,"Rs 23,920.00","₹ 14,950.00",,,1,,"Rs 23,920.00",
3/4/2025 10:08:51,9781260461350,"TINTINALLI'S EMERGENCY MEDICINE, 9e",Medical,Hardcover,"Rs 22,320.00","₹ 13,947.87",,,1,,"Rs 22,320.00",
3/4/2025 10:08:51,9781787791732,Recent Advances in Obstetrics and Gynaecology 28,Medical,Paperback,"Rs 2,800.00",,,,3,,"Rs 8,400.00",
3/4/2025 10:08:51,9789356968554,DC Dutta’s Textbook of Gynecology,Medical,Paperback,"Rs 2,072.00",,,,4,,"Rs 8,288.00",
3/4/2025 10:08:51,9788194080008,Bedside Clinics In medicine Part II 7e,Medical,Paperback,Rs 792.00,,,,4,,"Rs 3,168.00",
3/4/2025 10:08:51,9789380108445,Management and Leadership for Nurse Administrators 5e,Medical,Paperback,"Rs 1,112.00",₹ 695.00,,,1,,"Rs 1,112.00",
3/4/2025 10:08:51,9788184486100,Fundamentals of Nursing ,Medical,Paperback,"Rs 1,960.00",,,,1,,"Rs 1,960.00",
3/4/2025 10:08:51,9780803622197,Understanding Medical Surgical Nursing With CD ROM,Medical,Hardcover,,,,,1,,Rs 0.00,
3/4/2025 10:08:51,9788184733921,Martins Physical Pharmacy and Pharmaceutical Sciences,Medical,Paperback,"Rs 3,200.00",,,,1,,"Rs 3,200.00",
3/4/2025 10:08:51,9789351296065,"Grant’s Atlas of Anatomy, 14e",Medical,Paperback,"Rs 5,040.00",,,,1,,"Rs 5,040.00",
3/4/2025 10:08:51,9780702053634,"Rang & Dale's Pharmacology, International Edition",Medical,Paperback,"Rs 3,740.00",,,,1,,"Rs 3,740.00",
3/4/2025 10:08:51,9780443075674,Lee / Braunwauld Atlas of Cardiac Imaging,Medical,Hardcover,,,,,1,,Rs 0.00,
3/4/2025 10:08:51,9789352705474,Textbook of Pathology with Pathology Quick Review,Medical,Hardcover,"Rs 3,510.00",,,,1,,"Rs 3,510.00",
3/4/2025 10:08:51,9789354664731,BD CHAURASIAS HUMAN ANATOMY 9ED VOL -1 REGIONAL AND APPLIED DISSECTION & CLINICAL,Medical,Paperback,"Rs 1,272.00",,,,2,,"Rs 2,544.00",
3/4/2025 10:08:51,9789354664762,BD CHAURASIAS HUMAN ANATOMY 9ED VOL2 REGIONAL AND APPLIED DISSECTION & CLINICAL,Medical,Paperback,"Rs 1,480.00",,,,2,,"Rs 2,960.00",
3/4/2025 10:08:51,9789354664779,BD CHAURASIAS HUMAN ANATOMY 9ED VOL 3 AND 4 REGIONAL AND APPLIED DISSECTION AND CLINICAL,Medical,Paperback,"Rs 1,840.00",,,,2,,"Rs 3,680.00",
3/4/2025 10:08:51,9788190401142,Bullets in pathology,Medical,Paperback,Rs 184.00,₹ 115.00,,,2,,Rs 368.00,
3/4/2025 10:08:51,9788131217672,Sailing Smoothly Through Pregnancy ,Medical,Paperback,Rs 470.00,,,,1,,Rs 470.00,
3/4/2025 10:08:51,9788170264941,Operative Cranio-Cerebral Topography for Neurosurgeons Paperback,Medical,Paperback,"Rs 1,752.00","₹ 1,095.00",,,1,,"Rs 1,752.00",
3/4/2025 10:08:51,9780702025785,Pass the MRCS: All the Techniques You Need (MRCS,Medical,Paperback,,,,,1,,Rs 0.00,
3/4/2025 10:08:51,9788123924649,TEXTBOOK OF HISTOLOGY COLOUR ATLAS,Medical,Paperback,,,,,1,,Rs 0.00,
3/4/2025 10:08:51,9999999999999,Principles of surgery,Medical,Paperback,Rs 300.00,,,,2,,Rs 600.00,
3/4/2025 10:08:51,9789353436520,Nursing Theories: The Base for Professional Nursing,Medical,Paperback,"Rs 1,358.00",₹ 849.00,,,1,,"Rs 1,358.00",
3/4/2025 10:08:51,9789386478399,Textbook Of Pathology 2 Vol Set (Pb 2017): Two-Vol Set: Two-Volume Set ,Medical,Hardcover,"Rs 2,800.00",,,,2,,"Rs 5,600.00",
3/4/2025 10:08:51,9789353060466,Fundamentals of Nursing ,Medical,Hardcover,"Rs 3,040.00",,,,2,,"Rs 6,080.00",
3/4/2025 10:08:51,9789351296058,"Fundamentals of Nursing,",Medical,Hardcover,"Rs 3,120.00",,,,1,,"Rs 3,120.00",
3/4/2025 10:08:51,9780443073274,"Basic Medical Sciences for MRCP Part 1, ",Medical,Paperback,"Rs 2,511.04",,£ 14.00,,1,,"Rs 2,511.04",
3/4/2025 10:08:51,9788123919522,Surface And Radiological Anatomy 3Ed (Pb 2020),Medical,Paperback,Rs 630.00,,,,1,,Rs 630.00,
3/4/2025 10:08:51,9789385915598,PRACTICAL PHYSIOLOGY FOR MBBS STUDENTS (PB,Medical,Paperback,,,,,1,,Rs 0.00,
3/4/2025 10:08:51,9780723438724,Iiiustated textbook of paidiatrics,Medical,Paperback,"Rs 3,680.00",,,,1,,"Rs 3,680.00",
3/4/2025 10:08:51,9781921569609,Disease free,Medical,Hardcover,,,,,1,,Rs 0.00,
3/4/2025 10:08:51,9781138031647,"Bailey & Love's Short Practice Of Surgery, 27Th Edition: International Student's Edition (Set Volume 1 & 2)",Medical,Paperback,"Rs 89,600.00",,,,1,,"Rs 89,600.00",
3/4/2025 10:08:51,9780323355179,Miller's Review of Orthopaedics,Medical,Paperback,"Rs 12,500.00",,,,1,,"Rs 12,500.00",
3/4/2025 10:08:51,9789352701865,Paniker’s Textbook of Medical Parasitology (Step by Step),Medical,Paperback,"Rs 1,080.00",,,,1,,"Rs 1,080.00",
3/4/2025 10:08:51,9780729541985,Clinical Examination (Without Student Consult),Medical,Paperback,"Rs 2,632.00",,,,1,,"Rs 2,632.00",
3/4/2025 10:08:51,9789386217554,TEXTBOOK OF COMMUNITY MEDICINE PREVENTIVE AND SOCIAL MEDICINE 5E,Medical,Paperback,,,,,1,,Rs 0.00,
3/4/2025 10:08:51,9788123928029,Textbook Of Radiology For Residents And Technicians 5E,Medical,Paperback,"Rs 1,680.00",,,,1,,"Rs 1,680.00",
3/4/2025 10:08:51,9780702029349,"Trease and Evans Pharmacognosy, International Edition",Medical,Paperback,"Rs 3,944.13",,£ 21.99,,1,,"Rs 3,944.13",
3/4/2025 10:08:51,9788184487060,Textbook of Forensic Medicine and Toxicology,Medical,Paperback,"Rs 1,430.00",,,,1,,"Rs 1,430.00",
3/4/2025 10:08:51,9788131235058,The Developing Human: Clinically Oriented Embryology,Medical,Paperback,"Rs 3,440.00",,,,1,,"Rs 3,440.00",
3/4/2025 10:08:51,9789385915970,Community Medicine Practical Guide 2Ed,Medical,,,₹ 550.00,,,1,,Rs 0.00,
3/4/2025 10:08:51,9789385915567,"Medical Pharmacology, 5e",Medical,Paperback,"Rs 7,110.00",,,,2,,"Rs 14,220.00",
3/4/2025 10:08:51,9789385915796,TEXTBOOK OF BIOCHEMISTRY 3ED (PB 2017),Medical,Paperback,"Rs 1,160.00",,,,1,,"Rs 1,160.00",
3/4/2025 10:08:51,9788131255018,"Medicine: Prep Manual For Undergraduates, 6/e",Medical,Paperback,"Rs 1,770.00",,,,1,,"Rs 1,770.00",
3/4/2025 10:08:51,9789352702381,Manual of Practical Medicine ,Medical,Paperback,"Rs 2,392.00",,,,1,,"Rs 2,392.00",
3/4/2025 10:08:51,9789352706853,Essential Orthopaedics (Including Clinical Methods),Medical,Paperback,"Rs 1,520.00",,,,1,,"Rs 1,520.00",
3/4/2025 10:08:51,9789350258675,Joint Structure And Function: A Comprehensive Analysis,Medical,Paperback,"Rs 1,430.00",,,,1,,"Rs 1,430.00",
3/4/2025 10:08:51,9788170264583,Management of Common Neurological & Neurosurgical Diseases,Medical,Paperback,Rs 792.00,₹ 495.00,,,1,,Rs 792.00,
3/4/2025 10:08:51,9788123922959,"Exam-Oriented Review in Physiology Chandrasekar, M.",Medical,Paperback,Rs 630.00,,,,1,,Rs 630.00,
3/4/2025 10:08:51,9788123922829,SYNOPSIS OF OTORHINOLARYNGOLOGY: INCLUDING INSTRUMENTS AND X-RAYS (PB 2013),Medical,Paperback,Rs 720.00,,,,1,,Rs 720.00,
3/4/2025 10:08:51,9788123911212,Exam Oriented Anatomy Below Diaphragm Questions And Answers,Medical,Paperback,"Rs 1,115.00",₹ 695.00,,,1,,"Rs 1,115.00",
3/4/2025 10:08:51,9788123912110,Exam Oriented Anatomy Below Diaphragm Questions And Answers,Medical,Paperback,"Rs 1,115.00",₹ 695.00,,,1,,"Rs 1,115.00",
3/4/2025 10:08:51,9788123919867,PRINCIPLES OF MEDICINAL CHEMISTRY INCLUDING PROTEOMICS: A COLLECTION OF THEORIES OF THEORIES AND LECTURE NOTES FOR THE STUDENTS,Medical,Paperback,Rs 480.00,₹ 300.00,,,1,,Rs 480.00,
3/4/2025 10:08:51,9788123928739,"Human Physiology Chatterjee, C.C. , Vol 2",Medical,Paperback,Rs 720.00,,,,1,,Rs 720.00,
3/4/2025 10:08:51,9788123928722,"Human Physiology Chatterjee, C.C. , Vol 1",Medical,Paperback,Rs 720.00,,,,1,,Rs 720.00,
3/4/2025 10:08:51,9780789471512,Complete Baby & Child Care ,Medical,Paperback,"Rs 2,121.00",,,$ 15.00,1,,"Rs 2,121.00",
3/4/2025 10:08:51,9789385915598,PRACTICAL PHYSIOLOGY FOR MBBS STUDENTS (PB 2016),Medical,Paperback,Rs 536.00,₹ 335.00,,,1,,Rs 536.00,
3/4/2025 10:08:51,9788184735086,Histology: Text & Atlas with Thepoint Access Scratch Code,Medical,Paperback,"Rs 1,080.00",,,,1,,"Rs 1,080.00",
3/4/2025 10:08:51,9781405170390,"Diagnostic Imaging, 6/E ",Medical,Paperback,"Rs 3,190.00",,,,1,,"Rs 3,190.00",
3/4/2025 10:08:51,9788123930282,"Medical Dictionary (English To Hindi), 3E",Medical,Paperback,Rs 352.00,₹ 220.00,,,1,,Rs 352.00,
3/4/2025 10:08:51,9788123927084,Preventive and Social Medicine,Medical,Paperback,Rs 720.00,,,,1,,Rs 720.00,
3/4/2025 10:08:51,9788131525173,PHARMACEUTICAL CALCULATIONS FOR PHARMACY TECHNICIANS: A WORKTEXT ,Medical,Paperback,"Rs 1,270.00",₹ 795.00,,,1,,"Rs 1,270.00",
3/4/2025 10:08:51,9788131257555,"Practical Fracture Treatment, International Edition, 5e",Medical,Paperback,"Rs 2,072.00",,,,1,,"Rs 2,072.00",
3/4/2025 10:08:51,9781260458824,Adams and Victor's Principles of Neurology 11th Edition,Medical,Hardcover,"Rs 15,200.00",,,,1,,"Rs 15,200.00",
3/4/2025 10:08:51,9789388313209,"Lippincott® Illustrated Reviews: Pharmacology, South Asian ed",Medical,Paperback,"Rs 3,400.00",,,,1,,"Rs 3,400.00",
3/4/2025 10:08:51,9788180612275,"Interlocking Nailing, 2e",Medical,Hardcover,"Rs 2,392.00","₹ 1,495.00",,,1,,"Rs 2,392.00",
3/4/2025 10:08:51,9789352700561,Practical ENT 3rd Edition,Medical,Paperback,Rs 520.00,,,,1,,Rs 520.00,
3/4/2025 10:08:51,9788131775707,NURSING RESEARCH AND STATISTICS ,Medical,Paperback,Rs 985.00,₹ 615.00,,,1,,Rs 985.00,
3/4/2025 10:08:51,9789380853901,Introduction To Nursing Research,Medical,Paperback,"Rs 1,592.00",₹ 995.00,,,1,,"Rs 1,592.00",
3/4/2025 10:08:51,9789384007164,Sociology for Nurses,Medical,Paperback,Rs 472.00,₹ 295.00,,,1,,Rs 472.00,
3/4/2025 10:08:51,9788190704625,Practical Medicine 21Ed (Pb 2018),Medical,Paperback,"Rs 1,480.00",₹ 925.00,,,2,,"Rs 2,960.00",
3/4/2025 10:08:51,9789352704491,Review of Radiology (PGMEE),Medical,Paperback,"Rs 1,280.00",Rs 984.00,,,1,,"Rs 1,280.00",
3/4/2025 10:08:51,9788174732811,"New Illustrated Medical Dictonary, Bansal",Medical,Paperback,Rs 888.00,₹ 555.00,,,1,,Rs 888.00,
3/4/2025 10:08:51,9780702026829,"Bailliere's Midwives' Dictionary, 10e",Medical,Paperback,Rs 538.08,,,,3,,"Rs 1,614.24",
3/4/2025 10:08:51,9780702022814,"Bailliere's Midwives' Dictionary, 9e",Medical,Paperback,Rs 538.08,,,,1,,Rs 538.08,
3/4/2025 10:08:51,9789388527729,AN ATLAS AND TEXT OF DERMATOLOGY FOR PRACTITIONERS 2ED,Medical,Paperback,,,,,1,,Rs 0.00,
3/4/2025 10:08:51,9788123923864,Single Best Response Multiple Choice Questions in Anatomy (PB 2017),Medical,Paperback,Rs 280.00,,,,1,,Rs 280.00,
3/4/2025 10:08:51,9788123902739,Introduction To Pharmaceutics I 3Ed (Pb 2018),Medical,Paperback,Rs 248.00,₹ 155.00,,,1,,Rs 248.00,
3/4/2025 10:08:51,9780443061967,Short Essay Questions for MRCOG Part 2 (MRCOG Study Guides),Medical,Paperback,,,,,1,,Rs 0.00,
3/4/2025 10:08:51,9788123924236,Dm Gastroenterology And Mch Gastrosurgery Entrance Examination 3Ed (Pb 2017) ,Medical,Paperback,Rs 470.00,,,,1,,Rs 470.00,
3/4/2025 10:08:51,9788189960797,"The Washington Manual Of Oncology, 2e",Medical,Paperback,"Rs 1,920.00",,,,1,,"Rs 1,920.00",
3/4/2025 10:08:51,9789351296706,"The Washington Manual of Surgery, 7ed ",Medical,Paperback,"Rs 2,392.00",,,,1,,"Rs 2,392.00",
3/4/2025 10:08:51,9789351296737,"The Washington Manual of Pediatrics, 2ed",Medical,Paperback,"Rs 2,255.00",,,,1,,"Rs 2,255.00",
3/4/2025 10:08:51,9788184736601,"Handbook of Neuroanesthesia, 5th South Asian ed",Medical,Paperback,"Rs 2,080.00",,,,1,,"Rs 2,080.00",
3/4/2025 10:08:51,9788184733938,Handbook For Principles And Practice Of Gynecologic Oncology ,Medical,Paperback,,,,,1,,Rs 0.00,
3/4/2025 10:08:51,9788184737141,Washington Manual Of Hematology And Oncology Subspecialty Consult,Medical,Paperback,"Rs 1,760.00",,,,1,,"Rs 1,760.00",
3/4/2025 10:08:51,9788184734416,"Handbook of Interventional Radiologic Procedures, 4e",Medical,Paperback,"Rs 1,720.00",,,,1,,"Rs 1,720.00",
3/4/2025 10:08:51,9788184735420,"Manual of Emergency Medicine, 6th South Asian ed",Medical,Paperback,"Rs 1,600.00",,,,1,,"Rs 1,600.00",
3/4/2025 10:08:51,9788194864554,Cloherty and Stark’s Manual of Neonatal Care South Asian Edition ,Medical,Paperback,"Rs 2,660.00",,,,3,,"Rs 7,980.00",
3/4/2025 10:08:51,9788125918769,"Manual of Nursing Arts and Procedures, 4e",Medical,Paperback,Rs 368.00,₹ 230.00,,,3,,"Rs 1,104.00",
3/4/2025 10:08:51,9798188039356,Clinical Methods in Dermatology and Venerelogy 5e,Medical,Paperback,Rs 288.00,₹ 180.00,,,3,,Rs 864.00,
3/4/2025 10:08:51,9798181474338,Handbook of pain management,Medical,Paperback,Rs 630.00,,,,1,,Rs 630.00,
3/4/2025 10:08:51,9781259009396,"PEDIATRICS PRETEST SELF-ASSESSMENT AND REVIEW (IE), 13e",Medical,Paperback,Rs 983.80,,,$ 6.95,1,,Rs 983.80,
3/4/2025 10:08:51,9789386479440,Davidson's Dictionary For Nurses,Medical,Paperback,Rs 472.00,₹ 295.00,,,1,,Rs 472.00,
3/4/2025 10:08:51,9788123903651,Textbook Of Pharmaceutical Organic Chemistry (Pb 2020),Medical,Paperback,Rs 288.00,₹ 180.00,,,1,,Rs 288.00,
3/4/2025 10:08:51,9788123918037,Manipal Manual Of Instruments (Pb 2019),Medical,Paperback,Rs 440.00,₹ 275.00,,,1,,Rs 440.00,
3/4/2025 10:08:51,9788123922300,Practical Biochemistry 5Ed (PB 2018) ,Medical,Paperback,Rs 496.00,₹ 310.00,,,1,,Rs 496.00,
3/4/2025 10:08:51,9789356963313,"DC Dutta’s Textbook of Obstetrics Including Perinatology & Contraception, 10E",Medical,Paperback,"Rs 2,392.00","₹ 1,495.00",,,6,,"Rs 14,352.00",
3/4/2025 10:08:51,9789366167497,Sakshi Arora's Self Assessment & Review Obstetrics,Medical,Paperback,"Rs 2,392.00","₹ 1,495.00",,,6,,"Rs 14,352.00",
3/4/2025 10:08:51,9789366162683,SAKSHI ARORA'S Self Assessment & Review Gynecology,Medical,Paperback,"Rs 2,392.00","₹ 1,495.00",,,6,,"Rs 14,352.00",
3/4/2025 10:08:51,9789356962026,"Essentials of Medical Pharmacology, 9e",Medical,Hardcover,"Rs 2,960.00","₹ 1,850.00",,,5,,"Rs 14,800.00",
3/4/2025 10:08:51,9789364445559,First Aid for the USMLE Step 1 2025,Medical,Paperback,"Rs 4,400.00","₹ 2,750.00",,,32,,"Rs 140,800.00",
3/4/2025 10:08:51,9789356963351,Aravind FAQs in Ophthalmology,Medical,Paperback,"Rs 2,712.00","₹ 1,695.00",,,0,,Rs 0.00,
3/4/2025 10:08:51,9788131270837,Pilbeam's Mechanical Ven 8th E/d 2024,Medical,Paperback,"Rs 4,792.00","₹ 2,995.00",,,0,,Rs 0.00,
3/4/2025 10:08:51,9789354666322,Kundu’s Practical Medicine An overview of physical examination 2/e,Medical,Paperback,Rs 792.00,₹ 495.00,,,2,,"Rs 1,584.00",
3/4/2025 10:08:51,9789354668746,"BD Chaurasia’s Human Anatomy, 10/e , Volumes 1– 4",Medical,Paperback,"Rs 5,904.00",,,,0,,Rs 0.00,
3/4/2025 10:08:51,9780443111099,"Kanski's Clinical Ophthalmology International Edition, 10e",Medical,Paperback,"Rs 11,832.00","₹ 7,395.00",,,1,,"Rs 11,832.00",
3/4/2025 10:08:51,9789390612345,"Manual of Cardiovascular Medicine, 1st South Asian ed",Medical,Paperback,"Rs 4,000.00","₹ 2,499.00",,,0,,Rs 0.00,
3/4/2025 10:08:51,9781260570090,SCHWARTZ'S PRINCIPLES OF SURGERY 2-volume set 11th edition,Medical,Paperback,"Rs 18,960.00","₹ 11,668.00",,,1,,"Rs 18,960.00",
3/4/2025 10:08:51,9780323883085,"Nelson Textbook of Pediatrics, 2-Volume Set International Edition: 22ed",Medical,Hardcover,"Rs 10,912.00","₹ 6,525.00",,,1,,"Rs 10,912.00",
3/4/2025 10:08:51,9789382951711,You Can Win Shiv Khera,"Self-Help, Non-Fiction",Paperback,Rs 720.00,₹ 450.00,,,4,,"Rs 2,880.00",
3/4/2025 10:08:51,9781804090947,"SAME AS EVER: Timeless Lessons on Risk, Opportunity and Living a Good Life","Self-Help, Non-Fiction",Paperback,Rs 720.00,₹ 450.00,,,3,,"Rs 2,160.00",
3/4/2025 10:08:51,9780091816971,Who Moved My Cheese,"Self-Help, Non-Fiction",Paperback,Rs 360.00,,,,3,,"Rs 1,080.00",
3/4/2025 10:08:51,9781847923677,When Breath Becomes Air,"Self-Help, Non-Fiction",Hardcover,Rs 960.00,₹ 599.00,,,1,,Rs 960.00,
3/4/2025 10:08:51,9781529920062,Determined: The Science of Life Without Free Will,"Self-Help, Non-Fiction",Paperback,"Rs 1,120.00",₹ 699.00,,,1,,"Rs 1,120.00",
3/4/2025 10:08:51,9781847941831,Atomic Habits,"Self-Help, Non-Fiction",Paperback,"Rs 1,440.00",₹ 899.00,,,6,,"Rs 8,640.00",
3/4/2025 10:08:51,9789390166268,The Psychology of Money,"Self-Help, Non-Fiction",Paperback,Rs 640.00,₹ 399.00,,,4,,"Rs 2,560.00",
3/4/2025 10:08:51,9789353047207,Train Your Brain: Ultimate Memory Hacks,"Self-Help, Non-Fiction",Paperback,Rs 475.00,₹ 295.00,,,1,,Rs 475.00,
3/4/2025 10:08:51,9781911717096,Nexus,"Self-Help, Non-Fiction",Paperback,"Rs 1,760.00","₹ 1,099.00",,,1,,"Rs 1,760.00",
3/4/2025 10:08:51,9789389000221,The Song of Achilles,"Self-Help, Non-Fiction",Paperback,Rs 960.00,₹ 599.00,,,1,,Rs 960.00,
3/4/2025 10:08:51,9780007555932,How to Take Charge of Your Life: The User’s Guide to NLP,"Self-Help, Non-Fiction",Paperback,Rs 960.00,₹ 599.00,,,1,,Rs 960.00,
3/4/2025 10:08:51,9780553175219,A Brief History Of Time,"Self-Help, Non-Fiction",Paperback,Rs 800.00,₹ 499.00,,,1,,Rs 800.00,
3/4/2025 10:08:51,9780099590088,Sapiens: A Brief History of Humankind,"Self-Help, Non-Fiction",Paperback,"Rs 1,120.00",₹ 699.00,,,1,,"Rs 1,120.00",
3/4/2025 10:08:51,9781784703936,Homo Deus: A Brief History of Tomorrow,"Self-Help, Non-Fiction",Paperback,"Rs 1,120.00",₹ 699.00,,,3,,"Rs 3,360.00",
3/4/2025 10:08:51,9781784708283,21 Lessons for the 21st Century,"Self-Help, Non-Fiction",Paperback,"Rs 1,120.00",₹ 699.00,,,3,,"Rs 3,360.00",
3/4/2025 10:08:51,9780141033570,Thinking Fast and Slow,"Self-Help, Non-Fiction",Paperback,"Rs 1,120.00",₹ 699.00,,,1,,"Rs 1,120.00",
3/4/2025 10:08:51,9780099575061,Behave: Robert Sapolsky,"Self-Help, Non-Fiction",Paperback,"Rs 1,120.00",₹ 699.00,,,1,,"Rs 1,120.00",
3/4/2025 10:08:51,9781471195709,7 Habits of Highly Effective People ,"Self-Help, Non-Fiction",Paperback,Rs 960.00,₹ 599.00,,,1,,Rs 960.00,
3/4/2025 10:08:51,9780857205155,The 3rd Alternative R. Stephen Covey,"Self-Help, Non-Fiction",Paperback,Rs 960.00,₹ 599.00,,,1,,Rs 960.00,
3/4/2025 10:08:51,9780571268832,My Name Is Red,"Self-Help, Non-Fiction",Paperback,Rs 960.00,₹ 599.00,,,1,,Rs 960.00,
3/4/2025 10:08:51,9781473668942,The Miracle Morning,"Self-Help, Non-Fiction",Paperback,Rs 640.00,₹ 399.00,,,2,,"Rs 1,280.00",
3/4/2025 10:08:51,9788184957297,Power Thinking,"Self-Help, Non-Fiction",Paperback,Rs 480.00,₹ 299.00,,,1,,Rs 480.00,
3/4/2025 10:08:51,9789386702319,There's a Carnival Today,"Self-Help, Non-Fiction",Paperback,Rs 560.00,₹ 350.00,,,4,,"Rs 2,240.00",
3/4/2025 10:08:51,9781861972781,"THE 48 LAWS OF POWER, Robert Greene","Self-Help, Non-Fiction",Paperback,"Rs 1,600.00",₹ 999.00,,,1,,"Rs 1,600.00",
3/4/2025 10:08:51,9781861974044,"THE CONCISE 48 LAWS OF POWER, Robert Greene","Self-Help, Non-Fiction",Paperback,Rs 960.00,₹ 599.00,,,2,,"Rs 1,920.00",
3/4/2025 10:08:51,9781781259191,"The Laws of Human Nature, Robert Greene","Self-Help, Non-Fiction",Paperback,"Rs 1,600.00",₹ 999.00,,,1,,"Rs 1,600.00",
3/4/2025 10:08:51,9781788161565,"THE CONCISE LAWS OF HUMAN NATURE, Robert Greene","Self-Help, Non-Fiction",Paperback,Rs 960.00,₹ 599.00,,,2,,"Rs 1,920.00",
3/4/2025 10:08:51,9781781250914,MASTERY,"Self-Help, Non-Fiction",Paperback,"Rs 1,600.00",₹ 999.00,,,1,,"Rs 1,600.00",
3/4/2025 10:08:51,9781861977694,The Art Of Seduction,"Self-Help, Non-Fiction",Paperback,"Rs 1,600.00",₹ 999.00,,,1,,"Rs 1,600.00",
3/4/2025 10:08:51,9781861976413,The Concise Art of Seduction,"Self-Help, Non-Fiction",Paperback,Rs 960.00,₹ 599.00,,,2,,"Rs 1,920.00",
3/4/2025 10:08:51,9781861979780,THE 33 STRATEGIES OF WAR,"Self-Help, Non-Fiction",Paperback,"Rs 1,440.00",₹ 899.00,,,1,,"Rs 1,440.00",
3/4/2025 10:08:51,9788183631341,Think & Grow Rich,"Self-Help, Non-Fiction",Paperback,Rs 315.00,₹ 195.00,,,7,,"Rs 2,205.00",
3/4/2025 10:08:51,9780140124996,How To Solve It,"Self-Help, Non-Fiction",Paperback,Rs 960.00,₹ 599.00,,,1,,Rs 960.00,
3/4/2025 10:08:51,9781847943705,High Performance,"Self-Help, Non-Fiction",Paperback,Rs 960.00,₹ 599.00,,,1,,Rs 960.00,
3/4/2025 10:08:51,9781786330895,Ikigai: Japanese secret to long and happy life,"Self-Help, Non-Fiction",Hardcover,Rs 880.00,₹ 550.00,,,1,,Rs 880.00,
3/4/2025 10:08:51,9780241373828,Oneness With All Life,"Self-Help, Non-Fiction",Hardcover,Rs 880.00,₹ 550.00,,,1,,Rs 880.00,
3/4/2025 10:08:51,9789354893896,The Almanack Of Naval Ravikant: A Guide to Wealth and Happiness,"Self-Help, Non-Fiction",Paperback,Rs 640.00,₹ 399.00,,,1,,Rs 640.00,
3/4/2025 10:08:51,9780671212094,How To Read A Book,"Self-Help, Non-Fiction",Paperback,Rs 960.00,,,,1,,Rs 960.00,
3/4/2025 10:08:51,9788172234997,The One Minute Manager,"Self-Help, Non-Fiction",Paperback,Rs 320.00,₹ 199.00,,,1,,Rs 320.00,
3/4/2025 10:08:51,9780553817959,The Present,"Self-Help, Non-Fiction",Paperback,Rs 320.00,₹ 199.00,,,1,,Rs 320.00,
3/4/2025 10:08:51,9789355431356,Don't Believe Everything You Think,"Self-Help, Non-Fiction",Paperback,Rs 480.00,₹ 299.00,,,1,,Rs 480.00,
3/4/2025 10:08:51,9780753552896,The Making of a Manager,"Self-Help, Non-Fiction",Paperback,"Rs 1,120.00",₹ 699.00,,,1,,"Rs 1,120.00",
3/4/2025 10:08:51,9780141988511,12 Rules for Life,"Self-Help, Non-Fiction",Paperback,Rs 960.00,₹ 599.00,,,1,,Rs 960.00,
3/4/2025 10:08:51,9789353338459,The Power of Your Subconscious Mind,"Self-Help, Non-Fiction",Paperback,Rs 315.00,₹ 195.00,,,1,,Rs 315.00,
3/4/2025 10:08:51,9780007272617,How to Talk to Anyone: 92 Little Tricks for Big Success in Relationships,"Self-Help, Non-Fiction",Paperback,Rs 640.00,₹ 399.00,,,1,,Rs 640.00,
3/4/2025 10:08:51,9789393559975,Supermindful: 52 Ways to Connect with Your Genius,"Self-Help, Non-Fiction",Paperback,Rs 560.00,₹ 350.00,,,1,,Rs 560.00,
3/4/2025 10:08:51,9788179925911,The Theory Of Everything,"Self-Help, Non-Fiction",Paperback,Rs 360.00,₹ 225.00,,,1,,Rs 360.00,
3/4/2025 10:08:51,9780712657594,"Flow, The classic work on how to achieve happiness","Self-Help, Non-Fiction",Paperback,"Rs 1,120.00",₹ 699.00,,,1,,"Rs 1,120.00",
3/4/2025 10:08:51,9780091929114,The 4-Hour Work Week,"Self-Help, Non-Fiction",Paperback,"Rs 1,280.00",₹ 799.00,,,1,,"Rs 1,280.00",
3/4/2025 10:08:51,9789351772071,Attitude is Everything change your attitude change your life!,"Self-Help, Non-Fiction",Paperback,Rs 360.00,₹ 225.00,,,2,,Rs 720.00,
3/4/2025 10:08:51,9781781251560,What Got You Here Wont Get You There,"Self-Help, Non-Fiction",Paperback,Rs 480.00,₹ 299.00,,,1,,Rs 480.00,
3/4/2025 10:08:51,9789937711708,Napoleon Hill's Success Principles,"Self-Help, Non-Fiction",Paperback,Rs 320.00,,,,3,,Rs 960.00,
3/4/2025 10:08:51,9781473667525,THE ART OF THE GOOD LIFE,"Self-Help, Non-Fiction",Paperback,Rs 800.00,,£ 9.99,,1,,Rs 800.00,
3/4/2025 10:08:51,9780749927899,SECRETS OF THE MILLIONAIRE MIND: THINK RICH TO GET RICH!,"Self-Help, Non-Fiction",Paperback,Rs 800.00,₹ 499.00,,,2,,"Rs 1,600.00",
3/4/2025 10:08:51,9780143066507,The Circle Of Reason,"Self-Help, Non-Fiction",Paperback,Rs 800.00,₹ 499.00,,,1,,Rs 800.00,
3/4/2025 10:08:51,9780198739838,"SUPERINTELLIGENCE: Paths, Dangers, Strategies","Self-Help, Non-Fiction",Paperback,Rs 880.00,,£ 9.99,,1,,Rs 880.00,
3/4/2025 10:08:51,9781847940933,Getting to Yes,"Self-Help, Non-Fiction",Paperback,Rs 960.00,₹ 599.00,,,1,,Rs 960.00,
3/4/2025 10:08:51,9781847942944,The Confident Mind,"Self-Help, Non-Fiction",Paperback,Rs 960.00,₹ 599.00,,,1,,Rs 960.00,
3/4/2025 10:08:51,9781911709350,The Art of Clear Thinking: A Fighter Pilot’s Guide to Making Tough Decisions,"Self-Help, Non-Fiction",Paperback,"Rs 1,280.00",₹ 799.00,,,2,,"Rs 2,560.00",
3/4/2025 10:08:51,9788172235390,"The Pilgrimage, Paulo Coelho","Fiction & Literature, Fiction",Paperback,Rs 640.00,₹ 399.00,,,1,,Rs 640.00,
3/4/2025 10:08:51,9788172235635,"Eleven Minutes, Paulo Coelho","Fiction & Literature, Fiction",Paperback,Rs 640.00,₹ 399.00,,,1,,Rs 640.00,
